"Title","URL","Platform","Binary question?","Percentage","# Forecasts","# Forecasters"
"Will there be more than 50 prediction questions embedded in LessWrong posts and comments this month?","https://elicit.org/binary?binaryQuestions.search=Will%20there be more than 50 prediction questions embedded in LessWrong posts and comments this month?&binaryQuestions.sortBy=popularity&limit=20&offset=0","Elicit",true,"56.34%",336,138
"Will more than 50 people predict on this post?","https://elicit.org/binary?binaryQuestions.search=Will%20more than 50 people predict on this post?&binaryQuestions.sortBy=popularity&limit=20&offset=0","Elicit",true,"81.86%",227,120
"Will AGI cause an existential catastrophe?","https://elicit.org/binary?binaryQuestions.search=Will%20AGI cause an existential catastrophe?&binaryQuestions.sortBy=popularity&limit=20&offset=0","Elicit",true,"36.85%",158,102
"Will AGI cause an existential catastrophe without additional intervention from the existing AI Alignment research community?","https://elicit.org/binary?binaryQuestions.search=Will%20AGI cause an existential catastrophe without additional intervention from the existing AI Alignment research community?&binaryQuestions.sortBy=popularity&limit=20&offset=0","Elicit",true,"52.70%",137,95
"Will there be an arms race dynamic in the lead-up to AGI?","https://elicit.org/binary?binaryQuestions.search=Will%20there be an arms race dynamic in the lead-up to AGI?&binaryQuestions.sortBy=popularity&limit=20&offset=0","Elicit",true,"75.52%",113,91
"The new English Strain is at least 50% more infectious than the currently dominant American strain of Covid-19","https://elicit.org/binary?binaryQuestions.search=The%20new English Strain is at least 50% more infectious than the currently dominant American strain of Covid-19&binaryQuestions.sortBy=popularity&limit=20&offset=0","Elicit",true,"62.91%",207,89
"Will a single AGI or AGI project achieve a decisive strategic advantage?","https://elicit.org/binary?binaryQuestions.search=Will%20a single AGI or AGI project achieve a decisive strategic advantage?&binaryQuestions.sortBy=popularity&limit=20&offset=0","Elicit",true,"61.63%",115,86
"How vivid is your visual imagination?","https://elicit.org/binary?binaryQuestions.search=How%20vivid is your visual imagination?&binaryQuestions.sortBy=popularity&limit=20&offset=0","Elicit",true,"50.68%",119,77
"Will we get AGI from deep learning with small variations, without more insights on a similar level to deep learning?","https://elicit.org/binary?binaryQuestions.search=Will%20we get AGI from deep learning with small variations, without more insights on a similar level to deep learning?&binaryQuestions.sortBy=popularity&limit=20&offset=0","Elicit",true,"33.50%",110,77
"Will > 50% of AGI researchers agree with safety concerns by 2030?","https://elicit.org/binary?binaryQuestions.search=Will%20> 50% of AGI researchers agree with safety concerns by 2030?&binaryQuestions.sortBy=popularity&limit=20&offset=0","Elicit",true,"42.70%",107,76
"Will we experience an existential catastrophe before we build AGI?","https://elicit.org/binary?binaryQuestions.search=Will%20we experience an existential catastrophe before we build AGI?&binaryQuestions.sortBy=popularity&limit=20&offset=0","Elicit",true,"11.79%",100,75
"How vivid is your sound imagination?","https://elicit.org/binary?binaryQuestions.search=How%20vivid is your sound imagination?&binaryQuestions.sortBy=popularity&limit=20&offset=0","Elicit",true,"61.17%",106,74
"Will there be another AI Winter (a period commonly referred to as such) before we develop AGI?","https://elicit.org/binary?binaryQuestions.search=Will%20there be another AI Winter (a period commonly referred to as such) before we develop AGI?&binaryQuestions.sortBy=popularity&limit=20&offset=0","Elicit",true,"28.63%",95,72
"Will we get AGI from 1-3 more insights on a similar level to deep learning?","https://elicit.org/binary?binaryQuestions.search=Will%20we get AGI from 1-3 more insights on a similar level to deep learning?&binaryQuestions.sortBy=popularity&limit=20&offset=0","Elicit",true,"43.12%",112,71
"There will be an additional distinct large wave of Covid-19 infections in the United States 2021","https://elicit.org/binary?binaryQuestions.search=There%20will be an additional distinct large wave of Covid-19 infections in the United States 2021&binaryQuestions.sortBy=popularity&limit=20&offset=0","Elicit",true,"60.43%",145,69
"How vivid is your taste imagination?","https://elicit.org/binary?binaryQuestions.search=How%20vivid is your taste imagination?&binaryQuestions.sortBy=popularity&limit=20&offset=0","Elicit",true,"25.73%",84,69
"How vivid is your smell imagination?","https://elicit.org/binary?binaryQuestions.search=How%20vivid is your smell imagination?&binaryQuestions.sortBy=popularity&limit=20&offset=0","Elicit",true,"25.41%",82,68
"Will we need > 3 breakthroughs on a similar level to deep learning to get AGI?","https://elicit.org/binary?binaryQuestions.search=Will%20we need > 3 breakthroughs on a similar level to deep learning to get AGI?&binaryQuestions.sortBy=popularity&limit=20&offset=0","Elicit",true,"25.38%",84,67
"Do you have a type of Synaesthesia?","https://elicit.org/binary?binaryQuestions.search=Do%20you have a type of Synaesthesia?&binaryQuestions.sortBy=popularity&limit=20&offset=0","Elicit",true,"19.76%",87,66
"How frequently do you think in words?","https://elicit.org/binary?binaryQuestions.search=How%20frequently do you think in words?&binaryQuestions.sortBy=popularity&limit=20&offset=0","Elicit",true,"78.13%",86,66
"Do you have an internal monologue?","https://elicit.org/binary?binaryQuestions.search=Do%20you have an internal monologue?&binaryQuestions.sortBy=popularity&limit=20&offset=0","Elicit",true,"82.28%",80,63
"How vivid is your touch imagination?","https://elicit.org/binary?binaryQuestions.search=How%20vivid is your touch imagination?&binaryQuestions.sortBy=popularity&limit=20&offset=0","Elicit",true,"36.13%",79,62
"How good is your memory?","https://elicit.org/binary?binaryQuestions.search=How%20good is your memory?&binaryQuestions.sortBy=popularity&limit=20&offset=0","Elicit",true,"53.25%",77,61
"How much control do you have over your mind?","https://elicit.org/binary?binaryQuestions.search=How%20much control do you have over your mind?&binaryQuestions.sortBy=popularity&limit=20&offset=0","Elicit",true,"45.59%",76,61
"Before reaching AGI, will we hit a point where we can no longer improve AI capabilities by scaling?","https://elicit.org/binary?binaryQuestions.search=Before%20reaching AGI, will we hit a point where we can no longer improve AI capabilities by scaling?&binaryQuestions.sortBy=popularity&limit=20&offset=0","Elicit",true,"42.76%",85,57
"Trump will win a second term","https://elicit.org/binary?binaryQuestions.search=Trump%20will win a second term&binaryQuestions.sortBy=popularity&limit=20&offset=0","Elicit",true,"46.20%",74,54
"Before reaching AGI, will we hit a point where we can no longer improve AI capabilities by scaling because we are unable to continue scaling?","https://elicit.org/binary?binaryQuestions.search=Before%20reaching AGI, will we hit a point where we can no longer improve AI capabilities by scaling because we are unable to continue scaling?&binaryQuestions.sortBy=popularity&limit=20&offset=0","Elicit",true,"24.51%",75,52
"Before reaching AGI, will we hit a point where we can no longer improve AI capabilities by scaling because the increase in AI capabilities from scaling plateaus?","https://elicit.org/binary?binaryQuestions.search=Before%20reaching AGI, will we hit a point where we can no longer improve AI capabilities by scaling because the increase in AI capabilities from scaling plateaus?&binaryQuestions.sortBy=popularity&limit=20&offset=0","Elicit",true,"31.56%",66,52
"Will the Hedonometer show an average happiness above 6.2 for Christmas day 2020?","https://elicit.org/binary?binaryQuestions.search=Will%20the Hedonometer show an average happiness above 6.2 for Christmas day 2020?&binaryQuestions.sortBy=popularity&limit=20&offset=0","Elicit",true,"32.77%",93,49
"Will the post ""Embedded Interactive Predictions on LessWrong"" get more than 80 karma by December 1st?","https://elicit.org/binary?binaryQuestions.search=Will%20the post ""Embedded Interactive Predictions on LessWrong"" get more than 80 karma by December 1st?&binaryQuestions.sortBy=popularity&limit=20&offset=0","Elicit",true,"89.52%",83,45
"Will interest in a January forecasting club be greater than 3.5/5?","https://elicit.org/binary?binaryQuestions.search=Will%20interest in a January forecasting club be greater than 3.5/5?&binaryQuestions.sortBy=popularity&limit=20&offset=0","Elicit",true,"55.93%",44,41
"Having a button/prompt for Elicit on LW would increase usage by at least 5x","https://elicit.org/binary?binaryQuestions.search=Having%20a button/prompt for Elicit on LW would increase usage by at least 5x&binaryQuestions.sortBy=popularity&limit=20&offset=0","Elicit",true,"60.22%",41,37
"By 2025 bitcoin will no longer be the highest traded cryptocurrency. ","https://elicit.org/binary?binaryQuestions.search=By%202025 bitcoin will no longer be the highest traded cryptocurrency. &binaryQuestions.sortBy=popularity&limit=20&offset=0","Elicit",true,"55.49%",37,35
"A Singularity will not occur by the year 2040.","https://elicit.org/binary?binaryQuestions.search=A%20Singularity will not occur by the year 2040.&binaryQuestions.sortBy=popularity&limit=20&offset=0","Elicit",true,"68.71%",42,34
"Will there be a 4 year interval in which world GDP doubles before the first 1 year interval in which world GDP doubles?","https://elicit.org/binary?binaryQuestions.search=Will%20there be a 4 year interval in which world GDP doubles before the first 1 year interval in which world GDP doubles?&binaryQuestions.sortBy=popularity&limit=20&offset=0","Elicit",true,"61.12%",42,33
"Before 2025, most of Russia will become part of the United States, or the reverse, or they will in some other manner become the same sovereign state, or part of the same sovereign state","https://elicit.org/binary?binaryQuestions.search=Before%202025, most of Russia will become part of the United States, or the reverse, or they will in some other manner become the same sovereign state, or part of the same sovereign state&binaryQuestions.sortBy=popularity&limit=20&offset=0","Elicit",true,"0.79%",34,32
"The Pope will be assassinated.","https://elicit.org/binary?binaryQuestions.search=The%20Pope will be assassinated.&binaryQuestions.sortBy=popularity&limit=20&offset=0","Elicit",true,"3.03%",32,30
"""There will only be three languages in the world - English, Spanish and Mandarin"" --Bill Walker, BBC","https://elicit.org/binary?binaryQuestions.search=""There%20will only be three languages in the world - English, Spanish and Mandarin"" --Bill Walker, BBC&binaryQuestions.sortBy=popularity&limit=20&offset=0","Elicit",true,"2.91%",33,29
"The real identity of Nakamoto Satoshi will be publicly known by 2022","https://elicit.org/binary?binaryQuestions.search=The%20real identity of Nakamoto Satoshi will be publicly known by 2022&binaryQuestions.sortBy=popularity&limit=20&offset=0","Elicit",true,"38.97%",31,29
"PredictionBook will still survive by the end of 2020","https://elicit.org/binary?binaryQuestions.search=PredictionBook%20will still survive by the end of 2020&binaryQuestions.sortBy=popularity&limit=20&offset=0","Elicit",true,"83.00%",40,29
"Will AGI cause existential catastrophe conditional on there being a 4 year period of doubling of world GDP before a 1 year period of doubling?","https://elicit.org/binary?binaryQuestions.search=Will%20AGI cause existential catastrophe conditional on there being a 4 year period of doubling of world GDP before a 1 year period of doubling?&binaryQuestions.sortBy=popularity&limit=20&offset=0","Elicit",true,"36.91%",34,29
"Will there be a 4 year interval in which world GDP growth doubles before the first 1 year interval in which world GDP growth doubles?","https://elicit.org/binary?binaryQuestions.search=Will%20there be a 4 year interval in which world GDP growth doubles before the first 1 year interval in which world GDP growth doubles?&binaryQuestions.sortBy=popularity&limit=20&offset=0","Elicit",true,"47.38%",47,28
"Will LessWrong add a button to embed interactive predictions before 2021-07-01?","https://elicit.org/binary?binaryQuestions.search=Will%20LessWrong add a button to embed interactive predictions before 2021-07-01?&binaryQuestions.sortBy=popularity&limit=20&offset=0","Elicit",true,"54.94%",47,28
"Will AGI cause existential catastrophe conditional on there being a 1 year period of doubling of world GDP without there first being a 4 year period of doubling?","https://elicit.org/binary?binaryQuestions.search=Will%20AGI cause existential catastrophe conditional on there being a 1 year period of doubling of world GDP without there first being a 4 year period of doubling?&binaryQuestions.sortBy=popularity&limit=20&offset=0","Elicit",true,"47.00%",34,28
"Flying cars will become the dominant form of transportation in at least one major world city by 2035.  ","https://elicit.org/binary?binaryQuestions.search=Flying%20cars will become the dominant form of transportation in at least one major world city by 2035.  &binaryQuestions.sortBy=popularity&limit=20&offset=0","Elicit",true,"8.81%",31,28
"No nuclear weapon will be used for the remainder of this decade. (Does not count tests)","https://elicit.org/binary?binaryQuestions.search=No%20nuclear weapon will be used for the remainder of this decade. (Does not count tests)&binaryQuestions.sortBy=popularity&limit=20&offset=0","Elicit",true,"82.13%",32,28
"No military draft in the United States before 2020.","https://elicit.org/binary?binaryQuestions.search=No%20military draft in the United States before 2020.&binaryQuestions.sortBy=popularity&limit=20&offset=0","Elicit",true,"90.27%",33,28
"Before 2030 organised religions will no longer exist in any meaningful way and religion will no longer have any political influence.","https://elicit.org/binary?binaryQuestions.search=Before%202030 organised religions will no longer exist in any meaningful way and religion will no longer have any political influence.&binaryQuestions.sortBy=popularity&limit=20&offset=0","Elicit",true,"8.68%",28,27
"Edward Snowden will be U.S. President before 2034","https://elicit.org/binary?binaryQuestions.search=Edward%20Snowden will be U.S. President before 2034&binaryQuestions.sortBy=popularity&limit=20&offset=0","Elicit",true,"0.23%",26,26
"Will AGI cause existential catastrophe conditional on there being a 4 year period of doubling of world GDP growth before a 1 year period of doubling?","https://elicit.org/binary?binaryQuestions.search=Will%20AGI cause existential catastrophe conditional on there being a 4 year period of doubling of world GDP growth before a 1 year period of doubling?&binaryQuestions.sortBy=popularity&limit=20&offset=0","Elicit",true,"40.24%",42,26
"California will secede from the United States before 2021","https://elicit.org/binary?binaryQuestions.search=California%20will secede from the United States before 2021&binaryQuestions.sortBy=popularity&limit=20&offset=0","Elicit",true,"0.68%",34,26
"Trump wins Nobel","https://elicit.org/binary?binaryQuestions.search=Trump%20wins Nobel&binaryQuestions.sortBy=popularity&limit=20&offset=0","Elicit",true,"10.55%",38,26
"Bitcoin was an official NSA or CIA project.","https://elicit.org/binary?binaryQuestions.search=Bitcoin%20was an official NSA or CIA project.&binaryQuestions.sortBy=popularity&limit=20&offset=0","Elicit",true,"1.88%",26,25
"Will AGI cause existential catastrophe conditional on there being a 1 year period of doubling of world GDP growth without there first being a 4 year period of doubling?","https://elicit.org/binary?binaryQuestions.search=Will%20AGI cause existential catastrophe conditional on there being a 1 year period of doubling of world GDP growth without there first being a 4 year period of doubling?&binaryQuestions.sortBy=popularity&limit=20&offset=0","Elicit",true,"46.84%",32,24
"""I predict that by 2020, China will ban foreign men from entering China, except for special cases.""","https://elicit.org/binary?binaryQuestions.search=""I%20predict that by 2020, China will ban foreign men from entering China, except for special cases.""&binaryQuestions.sortBy=popularity&limit=20&offset=0","Elicit",true,"9.69%",26,23
"Queen Elizabeth II will abdicate before her death.","https://elicit.org/binary?binaryQuestions.search=Queen%20Elizabeth II will abdicate before her death.&binaryQuestions.sortBy=popularity&limit=20&offset=0","Elicit",true,"7.46%",26,23
"The Singularity will occur by 2050.","https://elicit.org/binary?binaryQuestions.search=The%20Singularity will occur by 2050.&binaryQuestions.sortBy=popularity&limit=20&offset=0","Elicit",true,"35.12%",25,23
"50% chance of AI by 2028 --Shane Legg","https://elicit.org/binary?binaryQuestions.search=50%%20chance of AI by 2028 --Shane Legg&binaryQuestions.sortBy=popularity&limit=20&offset=0","Elicit",true,"24.39%",28,23
"Computer Go running on commodity hardware (<$2k) to reach world champion level (>=9 dan) by 2030","https://elicit.org/binary?binaryQuestions.search=Computer%20Go running on commodity hardware (<$2k) to reach world champion level (>=9 dan) by 2030&binaryQuestions.sortBy=popularity&limit=20&offset=0","Elicit",true,"84.11%",27,22
"Will there be an ""Inverse AlphaFold"" by end of 2025?","https://elicit.org/binary?binaryQuestions.search=Will%20there be an ""Inverse AlphaFold"" by end of 2025?&binaryQuestions.sortBy=popularity&limit=20&offset=0","Elicit",true,"33.91%",33,22
"PredictionBook.com will be up and running 10 years from today - 5/31/2023 - with this individual prediction still accessible.","https://elicit.org/binary?binaryQuestions.search=PredictionBook.com%20will be up and running 10 years from today - 5/31/2023 - with this individual prediction still accessible.&binaryQuestions.sortBy=popularity&limit=20&offset=0","Elicit",true,"68.88%",25,22
"Polyamory will have legal status in the USA similar to 2013's gay marriage by 2035.","https://elicit.org/binary?binaryQuestions.search=Polyamory%20will have legal status in the USA similar to 2013's gay marriage by 2035.&binaryQuestions.sortBy=popularity&limit=20&offset=0","Elicit",true,"19.35%",23,22
"By 2020, Eliezer Yudkowsky will have given up building friendly AI.","https://elicit.org/binary?binaryQuestions.search=By%202020, Eliezer Yudkowsky will have given up building friendly AI.&binaryQuestions.sortBy=popularity&limit=20&offset=0","Elicit",true,"6.67%",24,22
"TurnTrout will use the Elicit embedding on LessWrong for a non-prediction question by 28-11-2020","https://elicit.org/binary?binaryQuestions.search=TurnTrout%20will use the Elicit embedding on LessWrong for a non-prediction question by 28-11-2020&binaryQuestions.sortBy=popularity&limit=20&offset=0","Elicit",true,"58.15%",39,21
"For most of history, a human attempting to use reasoning to do things like cooking, crafting, or planning (instead of using inherited cultural heuristics, like omens or folk wisdom), would have been substantially worse off, and faced a major increase in their risk of death (without a commensurate increase in life quality).","https://elicit.org/binary?binaryQuestions.search=For%20most of history, a human attempting to use reasoning to do things like cooking, crafting, or planning (instead of using inherited cultural heuristics, like omens or folk wisdom), would have been substantially worse off, and faced a major increase in their risk of death (without a commensurate increase in life quality).&binaryQuestions.sortBy=popularity&limit=20&offset=0","Elicit",true,"59.38%",32,21
"In 2070 there will be a human alive with age 150 or older.","https://elicit.org/binary?binaryQuestions.search=In%202070 there will be a human alive with age 150 or older.&binaryQuestions.sortBy=popularity&limit=20&offset=0","Elicit",true,"26.36%",25,21
"Most babies born in 2022 do not have Zika virus.","https://elicit.org/binary?binaryQuestions.search=Most%20babies born in 2022 do not have Zika virus.&binaryQuestions.sortBy=popularity&limit=20&offset=0","Elicit",true,"99.41%",22,21
"China and Japan will engage in armed conflict with each other resulting in > 1,000 deaths before 2023.","https://elicit.org/binary?binaryQuestions.search=China%20and Japan will engage in armed conflict with each other resulting in > 1,000 deaths before 2023.&binaryQuestions.sortBy=popularity&limit=20&offset=0","Elicit",true,"7.45%",22,20
"Chess will be solved within 10 years, and the end result will be a draw for Black.","https://elicit.org/binary?binaryQuestions.search=Chess%20will be solved within 10 years, and the end result will be a draw for Black.&binaryQuestions.sortBy=popularity&limit=20&offset=0","Elicit",true,"15.33%",21,20
"Homo sapiens will be near or fully extinct by 2100.","https://elicit.org/binary?binaryQuestions.search=Homo%20sapiens will be near or fully extinct by 2100.&binaryQuestions.sortBy=popularity&limit=20&offset=0","Elicit",true,"21.64%",22,20
"Google will survive for 15 more years","https://elicit.org/binary?binaryQuestions.search=Google%20will survive for 15 more years&binaryQuestions.sortBy=popularity&limit=20&offset=0","Elicit",true,"88.38%",21,20
"Before 2020 organized religions will have no political influence.","https://elicit.org/binary?binaryQuestions.search=Before%202020 organized religions will have no political influence.&binaryQuestions.sortBy=popularity&limit=20&offset=0","Elicit",true,"11.68%",22,20
"Magick qua magick works AND hinges on the intersection between quantum physics and decision theory.","https://elicit.org/binary?binaryQuestions.search=Magick%20qua magick works AND hinges on the intersection between quantum physics and decision theory.&binaryQuestions.sortBy=popularity&limit=20&offset=0","Elicit",true,"4.74%",23,20
"Background knowledge and motivation levels being equal, humans will learn how to perform new tasks at roughly equal rates.","https://elicit.org/binary?binaryQuestions.search=Background%20knowledge and motivation levels being equal, humans will learn how to perform new tasks at roughly equal rates.&binaryQuestions.sortBy=popularity&limit=20&offset=0","Elicit",true,"18.43%",23,19
"Robin Hanson: In 2032, less than 50% of cars on the road will completely autonomous. (to be assessed by asking an unbiased expert if the answer is not obvious) ","https://elicit.org/binary?binaryQuestions.search=Robin%20Hanson: In 2032, less than 50% of cars on the road will completely autonomous. (to be assessed by asking an unbiased expert if the answer is not obvious) &binaryQuestions.sortBy=popularity&limit=20&offset=0","Elicit",true,"54.20%",20,19
"Machiavellian Intelligence Hypothesis: humans evolved big brains in order to succeed at social manuevering and climbing dominance hierarchies.","https://elicit.org/binary?binaryQuestions.search=Machiavellian%20Intelligence Hypothesis: humans evolved big brains in order to succeed at social manuevering and climbing dominance hierarchies.&binaryQuestions.sortBy=popularity&limit=20&offset=0","Elicit",true,"60.07%",30,19
"Conditional on the AI community learning of pre-AGI catastrophic deceptive misalignment, will the ($ spent on AI alignment research)/($ spent on AI research) ratio increase by more than 50% over the two years following the catastrophe?","https://elicit.org/binary?binaryQuestions.search=Conditional%20on the AI community learning of pre-AGI catastrophic deceptive misalignment, will the ($ spent on AI alignment research)/($ spent on AI research) ratio increase by more than 50% over the two years following the catastrophe?&binaryQuestions.sortBy=popularity&limit=20&offset=0","Elicit",true,"39.69%",35,18
"Before AGI, will we learn of an example of catastrophic deceptive misalignment?","https://elicit.org/binary?binaryQuestions.search=Before%20AGI, will we learn of an example of catastrophic deceptive misalignment?&binaryQuestions.sortBy=popularity&limit=20&offset=0","Elicit",true,"56.94%",35,19
"No human revived from cryonic suspension by 2040.","https://elicit.org/binary?binaryQuestions.search=No%20human revived from cryonic suspension by 2040.&binaryQuestions.sortBy=popularity&limit=20&offset=0","Elicit",true,"86.75%",24,19
"Brexit will cause hundreds of thousands of deaths from mass starvation in the UK --Charlie Stross","https://elicit.org/binary?binaryQuestions.search=Brexit%20will cause hundreds of thousands of deaths from mass starvation in the UK --Charlie Stross&binaryQuestions.sortBy=popularity&limit=20&offset=0","Elicit",true,"2.21%",19,19
"United States will invade Australia and take over","https://elicit.org/binary?binaryQuestions.search=United%20States will invade Australia and take over&binaryQuestions.sortBy=popularity&limit=20&offset=0","Elicit",true,"10.00%",21,19
"90% chance of AI by 2050 --Shane Legg","https://elicit.org/binary?binaryQuestions.search=90%%20chance of AI by 2050 --Shane Legg&binaryQuestions.sortBy=popularity&limit=20&offset=0","Elicit",true,"47.05%",21,19
"Contrary to my left leanings, Man Made Global Warming will be proved incorrect by 2022","https://elicit.org/binary?binaryQuestions.search=Contrary%20to my left leanings, Man Made Global Warming will be proved incorrect by 2022&binaryQuestions.sortBy=popularity&limit=20&offset=0","Elicit",true,"6.95%",20,19
"No human will visit the moon from 2012-2020.","https://elicit.org/binary?binaryQuestions.search=No%20human will visit the moon from 2012-2020.&binaryQuestions.sortBy=popularity&limit=20&offset=0","Elicit",true,"74.85%",20,19
"The United States will contain exactly 50 states by 2025.","https://elicit.org/binary?binaryQuestions.search=The%20United States will contain exactly 50 states by 2025.&binaryQuestions.sortBy=popularity&limit=20&offset=0","Elicit",true,"72.43%",23,19
