"Title","URL","Platform","Binary question?","Percentage","# Forecasts","# Forecasters"
"By 2022,  autonomous drones will have been used by a government agency to kill someone.","https://elicit.org/binary?binaryQuestions.search=By%202022,  autonomous drones will have been used by a government agency to kill someone.&binaryQuestions.sortBy=popularity&limit=20&offset=0","Elicit",true,"53.00%",14,14
"The United States will contain more than 50 states by 2025.","https://elicit.org/binary?binaryQuestions.search=The%20United States will contain more than 50 states by 2025.&binaryQuestions.sortBy=popularity&limit=20&offset=0","Elicit",true,"30.26%",19,14
"By mid-century, Mandarin will be more widely spoken in Africa than English. ","https://elicit.org/binary?binaryQuestions.search=By%20mid-century, Mandarin will be more widely spoken in Africa than English. &binaryQuestions.sortBy=popularity&limit=20&offset=0","Elicit",true,"28.21%",14,14
"Hacking and cyberterrorism will be punishable by death worldwide by Dec. 1, 2029.","https://elicit.org/binary?binaryQuestions.search=Hacking%20and cyberterrorism will be punishable by death worldwide by Dec. 1, 2029.&binaryQuestions.sortBy=popularity&limit=20&offset=0","Elicit",true,"7.00%",18,14
"A right wing billionaire is behind the creation of bitcoin.","https://elicit.org/binary?binaryQuestions.search=A%20right wing billionaire is behind the creation of bitcoin.&binaryQuestions.sortBy=popularity&limit=20&offset=0","Elicit",true,"8.79%",14,14
"By 2022, [almost] every new car will have broadband Internet. -- Alyssa Vance","https://elicit.org/binary?binaryQuestions.search=By%202022, [almost] every new car will have broadband Internet. -- Alyssa Vance&binaryQuestions.sortBy=popularity&limit=20&offset=0","Elicit",true,"44.15%",13,13
"ETI is AGI","https://elicit.org/binary?binaryQuestions.search=ETI%20is AGI&binaryQuestions.sortBy=popularity&limit=20&offset=0","Elicit",true,"84.61%",18,13
"Humanity still a thing in 2036","https://elicit.org/binary?binaryQuestions.search=Humanity%20still a thing in 2036&binaryQuestions.sortBy=popularity&limit=20&offset=0","Elicit",true,"89.00%",13,13
"There be a ""SETI Winter"" before First Contact.","https://elicit.org/binary?binaryQuestions.search=There%20be a ""SETI Winter"" before First Contact.&binaryQuestions.sortBy=popularity&limit=20&offset=0","Elicit",true,"73.89%",19,13
"We will experience an existential catastrophe before First Contact.","https://elicit.org/binary?binaryQuestions.search=We%20will experience an existential catastrophe before First Contact.&binaryQuestions.sortBy=popularity&limit=20&offset=0","Elicit",true,"40.84%",19,13
"The tech will exist and be relatively safe for media to be uploaded directly into the human brain by 2026.","https://elicit.org/binary?binaryQuestions.search=The%20tech will exist and be relatively safe for media to be uploaded directly into the human brain by 2026.&binaryQuestions.sortBy=popularity&limit=20&offset=0","Elicit",true,"14.62%",13,13
"If First Contact is in physical form, will the ETI ""spaceship"" be larger than 1m in size?","https://elicit.org/binary?binaryQuestions.search=If%20First Contact is in physical form, will the ETI ""spaceship"" be larger than 1m in size?&binaryQuestions.sortBy=popularity&limit=20&offset=0","Elicit",true,"51.36%",14,13
"Before receiving a message from outer space, will we need a technological breakthrough (e.g., by discovering yet unknown elementary particles)","https://elicit.org/binary?binaryQuestions.search=Before%20receiving a message from outer space, will we need a technological breakthrough (e.g., by discovering yet unknown elementary particles)&binaryQuestions.sortBy=popularity&limit=20&offset=0","Elicit",true,"29.33%",18,13
"Generic AI won't happen in the next 10 years.","https://elicit.org/binary?binaryQuestions.search=Generic%20AI won't happen in the next 10 years.&binaryQuestions.sortBy=popularity&limit=20&offset=0","Elicit",true,"85.31%",16,13
"Joe Biden is the sitting president 4 years from today","https://elicit.org/binary?binaryQuestions.search=Joe%20Biden is the sitting president 4 years from today&binaryQuestions.sortBy=popularity&limit=20&offset=0","Elicit",true,"33.75%",16,13
"...create buildings where the expected yearly damage from earthquakes (both in terms of reduced quality of life and property destroyed) is >1.5x that of nearby buildings on old land.","https://elicit.org/binary?binaryQuestions.search=...create%20buildings where the expected yearly damage from earthquakes (both in terms of reduced quality of life and property destroyed) is >1.5x that of nearby buildings on old land.&binaryQuestions.sortBy=popularity&limit=20&offset=0","Elicit",true,"37.07%",15,13
"Will the number of active COVID cases in California increase by more than 15K between Fri 11/20 and Sun 11/22?","https://elicit.org/binary?binaryQuestions.search=Will%20the number of active COVID cases in California increase by more than 15K between Fri 11/20 and Sun 11/22?&binaryQuestions.sortBy=popularity&limit=20&offset=0","Elicit",true,"71.29%",21,13
"Reproductive human cloning widely socially accepted by 2040. -- Axel Boldt","https://elicit.org/binary?binaryQuestions.search=Reproductive%20human cloning widely socially accepted by 2040. -- Axel Boldt&binaryQuestions.sortBy=popularity&limit=20&offset=0","Elicit",true,"32.06%",16,13
"""The Essential Workers"" (or similar subject) will be TIME Magazine's Person of the Year for 2020.","https://elicit.org/binary?binaryQuestions.search=""The%20Essential Workers"" (or similar subject) will be TIME Magazine's Person of the Year for 2020.&binaryQuestions.sortBy=popularity&limit=20&offset=0","Elicit",true,"40.27%",15,13
"North Korea will invade South Korea by January 1st, 2022","https://elicit.org/binary?binaryQuestions.search=North%20Korea will invade South Korea by January 1st, 2022&binaryQuestions.sortBy=popularity&limit=20&offset=0","Elicit",true,"5.33%",15,13
"All children in the US must have GPS attached to them in some sense by law if they leave their parents house.","https://elicit.org/binary?binaryQuestions.search=All%20children in the US must have GPS attached to them in some sense by law if they leave their parents house.&binaryQuestions.sortBy=popularity&limit=20&offset=0","Elicit",true,"4.92%",13,13
"Average world IQ to decrease from 2015 to 2050","https://elicit.org/binary?binaryQuestions.search=Average%20world IQ to decrease from 2015 to 2050&binaryQuestions.sortBy=popularity&limit=20&offset=0","Elicit",true,"29.79%",14,13
"...all-things-considered, be good for the world.","https://elicit.org/binary?binaryQuestions.search=...all-things-considered,%20be good for the world.&binaryQuestions.sortBy=popularity&limit=20&offset=0","Elicit",true,"81.32%",19,13
"Fusion Power will revolutionize the world energy demands by 2025.","https://elicit.org/binary?binaryQuestions.search=Fusion%20Power will revolutionize the world energy demands by 2025.&binaryQuestions.sortBy=popularity&limit=20&offset=0","Elicit",true,"9.47%",15,13
"Our descendants will colonize millions of star systems within ten thousand years or so. -- Robin Hanson","https://elicit.org/binary?binaryQuestions.search=Our%20descendants will colonize millions of star systems within ten thousand years or so. -- Robin Hanson&binaryQuestions.sortBy=popularity&limit=20&offset=0","Elicit",true,"27.64%",14,13
"USA mints a coin worth $1,000,000,000 or more before 2021","https://elicit.org/binary?binaryQuestions.search=USA%20mints a coin worth $1,000,000,000 or more before 2021&binaryQuestions.sortBy=popularity&limit=20&offset=0","Elicit",true,"4.50%",16,13
"Truly ""Pilotless"" air travel will be the standard in 2050.","https://elicit.org/binary?binaryQuestions.search=Truly%20""Pilotless"" air travel will be the standard in 2050.&binaryQuestions.sortBy=popularity&limit=20&offset=0","Elicit",true,"62.71%",14,13
"The Roman Catholic Church ordains female priests before 2033.","https://elicit.org/binary?binaryQuestions.search=The%20Roman Catholic Church ordains female priests before 2033.&binaryQuestions.sortBy=popularity&limit=20&offset=0","Elicit",true,"18.54%",13,13
"In the next ten years, self-identified Libertarians will outnumber self-identified Republicans in the US. ","https://elicit.org/binary?binaryQuestions.search=In%20the next ten years, self-identified Libertarians will outnumber self-identified Republicans in the US. &binaryQuestions.sortBy=popularity&limit=20&offset=0","Elicit",true,"14.69%",13,13
"Trump dies of COVID-19","https://elicit.org/binary?binaryQuestions.search=Trump%20dies of COVID-19&binaryQuestions.sortBy=popularity&limit=20&offset=0","Elicit",true,"6.63%",32,13
"By 2030, mothers will be the primary breadwinner in the majority of households with children in the U.S.","https://elicit.org/binary?binaryQuestions.search=By%202030, mothers will be the primary breadwinner in the majority of households with children in the U.S.&binaryQuestions.sortBy=popularity&limit=20&offset=0","Elicit",true,"38.31%",13,13
"10 million","https://elicit.org/binary?binaryQuestions.search=10%20million&binaryQuestions.sortBy=popularity&limit=20&offset=0","Elicit",true,"8.42%",36,13
"Human level AI by 2029 (Ray Kurzweil, ""How to create a mind"")","https://elicit.org/binary?binaryQuestions.search=Human%20level AI by 2029 (Ray Kurzweil, ""How to create a mind"")&binaryQuestions.sortBy=popularity&limit=20&offset=0","Elicit",true,"26.75%",16,13
"Saudi Arabian government collapses within the next 5 years.","https://elicit.org/binary?binaryQuestions.search=Saudi%20Arabian government collapses within the next 5 years.&binaryQuestions.sortBy=popularity&limit=20&offset=0","Elicit",true,"10.69%",16,13
"Satoshi Nakamoto is just Wei Dai and this is known before 2060","https://elicit.org/binary?binaryQuestions.search=Satoshi%20Nakamoto is just Wei Dai and this is known before 2060&binaryQuestions.sortBy=popularity&limit=20&offset=0","Elicit",true,"13.37%",19,13
"By 2065, a majority of the world will be vegan. ","https://elicit.org/binary?binaryQuestions.search=By%202065, a majority of the world will be vegan. &binaryQuestions.sortBy=popularity&limit=20&offset=0","Elicit",true,"11.08%",13,13
"Steve Jobs' brain was cryopreserved or plastinated within two weeks of declaration of death, and this is known before 2070.","https://elicit.org/binary?binaryQuestions.search=Steve%20Jobs' brain was cryopreserved or plastinated within two weeks of declaration of death, and this is known before 2070.&binaryQuestions.sortBy=popularity&limit=20&offset=0","Elicit",true,"4.08%",13,13
"Kanye West elected President by 2032 -- Scott Adams","https://elicit.org/binary?binaryQuestions.search=Kanye%20West elected President by 2032 -- Scott Adams&binaryQuestions.sortBy=popularity&limit=20&offset=0","Elicit",true,"0.60%",15,12
"If we find indications of a dormant artifact buried on the moon, should we dig it up?","https://elicit.org/binary?binaryQuestions.search=If%20we find indications of a dormant artifact buried on the moon, should we dig it up?&binaryQuestions.sortBy=popularity&limit=20&offset=0","Elicit",true,"70.00%",15,12
"If the message is not shared, will it yield a decisive advantage for its owner?","https://elicit.org/binary?binaryQuestions.search=If%20the message is not shared, will it yield a decisive advantage for its owner?&binaryQuestions.sortBy=popularity&limit=20&offset=0","Elicit",true,"43.11%",19,12
"The first person to set foot on Mars will have left Earth holding American citizenship.","https://elicit.org/binary?binaryQuestions.search=The%20first person to set foot on Mars will have left Earth holding American citizenship.&binaryQuestions.sortBy=popularity&limit=20&offset=0","Elicit",true,"46.69%",13,12
"Effective HIV vaccine developed by 2040. -- Axel Boldt","https://elicit.org/binary?binaryQuestions.search=Effective%20HIV vaccine developed by 2040. -- Axel Boldt&binaryQuestions.sortBy=popularity&limit=20&offset=0","Elicit",true,"69.69%",13,12
"Will a message from outer space contain deep and profound information?","https://elicit.org/binary?binaryQuestions.search=Will%20a message from outer space contain deep and profound information?&binaryQuestions.sortBy=popularity&limit=20&offset=0","Elicit",true,"52.47%",15,12
"There will be a Youtube video with more views (on Youtube) than there will be living humans before 2020.","https://elicit.org/binary?binaryQuestions.search=There%20will be a Youtube video with more views (on Youtube) than there will be living humans before 2020.&binaryQuestions.sortBy=popularity&limit=20&offset=0","Elicit",true,"63.00%",13,12
"Joe Biden dies of coronavirus in 2020","https://elicit.org/binary?binaryQuestions.search=Joe%20Biden dies of coronavirus in 2020&binaryQuestions.sortBy=popularity&limit=20&offset=0","Elicit",true,"4.64%",14,12
"In 2060 there will be a human alive with age 140 or older.","https://elicit.org/binary?binaryQuestions.search=In%202060 there will be a human alive with age 140 or older.&binaryQuestions.sortBy=popularity&limit=20&offset=0","Elicit",true,"46.07%",14,12
"North Korea and South Korea to unify by 2030","https://elicit.org/binary?binaryQuestions.search=North%20Korea and South Korea to unify by 2030&binaryQuestions.sortBy=popularity&limit=20&offset=0","Elicit",true,"20.25%",16,12
"The European Union will unite into a single super state by 2030.","https://elicit.org/binary?binaryQuestions.search=The%20European Union will unite into a single super state by 2030.&binaryQuestions.sortBy=popularity&limit=20&offset=0","Elicit",true,"17.50%",14,12
"the average lifespan will be eighty-five to ninety in 2100. --S. Jay Olshansky","https://elicit.org/binary?binaryQuestions.search=the%20average lifespan will be eighty-five to ninety in 2100. --S. Jay Olshansky&binaryQuestions.sortBy=popularity&limit=20&offset=0","Elicit",true,"7.64%",14,12
"No amendments to the United States Constitution will be ratified by 2030.","https://elicit.org/binary?binaryQuestions.search=No%20amendments to the United States Constitution will be ratified by 2030.&binaryQuestions.sortBy=popularity&limit=20&offset=0","Elicit",true,"60.83%",12,12
"...significantly worsen traffic in San Francisco.","https://elicit.org/binary?binaryQuestions.search=...significantly%20worsen traffic in San Francisco.&binaryQuestions.sortBy=popularity&limit=20&offset=0","Elicit",true,"58.67%",12,12
"Decision-makers in media and PR, and corporate and government elites generally, have a lower tolerance for verbal conflict and taboo violations than the typical individual.","https://elicit.org/binary?binaryQuestions.search=Decision-makers%20in media and PR, and corporate and government elites generally, have a lower tolerance for verbal conflict and taboo violations than the typical individual.&binaryQuestions.sortBy=popularity&limit=20&offset=0","Elicit",true,"79.65%",17,12
"Alphabet/Google buys Microsoft","https://elicit.org/binary?binaryQuestions.search=Alphabet/Google%20buys Microsoft&binaryQuestions.sortBy=popularity&limit=20&offset=0","Elicit",true,"7.71%",14,12
"We will detect evidence of Intelligent alien life within the next 50 years. ","https://elicit.org/binary?binaryQuestions.search=We%20will detect evidence of Intelligent alien life within the next 50 years. &binaryQuestions.sortBy=popularity&limit=20&offset=0","Elicit",true,"24.33%",12,12
"“There will be a casino on the moon by 2040.”","https://elicit.org/binary?binaryQuestions.search=“There%20will be a casino on the moon by 2040.”&binaryQuestions.sortBy=popularity&limit=20&offset=0","Elicit",true,"3.83%",12,12
"Will first contact cause an existential catastrophe?","https://elicit.org/binary?binaryQuestions.search=Will%20first contact cause an existential catastrophe?&binaryQuestions.sortBy=popularity&limit=20&offset=0","Elicit",true,"49.24%",33,12
"By 2020, there will be a new World government. --Ray Kurzweil","https://elicit.org/binary?binaryQuestions.search=By%202020, there will be a new World government. --Ray Kurzweil&binaryQuestions.sortBy=popularity&limit=20&offset=0","Elicit",true,"2.73%",15,12
"100 million","https://elicit.org/binary?binaryQuestions.search=100%20million&binaryQuestions.sortBy=popularity&limit=20&offset=0","Elicit",true,"0.79%",29,12
"Some modes of the Large Hadron collider will never be reached and by 2025 the scientific community will debate in a peer reviewed physics journal with >median impact that this is due to the anthropic principle combined with the danger of those modes.","https://elicit.org/binary?binaryQuestions.search=Some%20modes of the Large Hadron collider will never be reached and by 2025 the scientific community will debate in a peer reviewed physics journal with >median impact that this is due to the anthropic principle combined with the danger of those modes.&binaryQuestions.sortBy=popularity&limit=20&offset=0","Elicit",true,"14.33%",15,12
"1 year continuous human habitation of the moon","https://elicit.org/binary?binaryQuestions.search=1%20year continuous human habitation of the moon&binaryQuestions.sortBy=popularity&limit=20&offset=0","Elicit",true,"15.93%",14,12
"If someone does experience a clogged drainpipe effect, is it possible to ""train it away""? That is, to, with 1000 hours of practice, get to a point where their life largely looks the same as it did before except that they report no longer experiencing the effect (and this is borne out by measures of # of quality-adjusted ideas babbled per time unit, or similar)? (It doesn't count if the only way of doing it is by, say, making sure to write 10 ideas every day, or something similar. I'm wondering if it's possible to change your cognition at a deep level, rather than using particular, deliberate, S2 techniques to sustain an equilibirum which you'd fall out of if you stopped using the techniques)","https://elicit.org/binary?binaryQuestions.search=If%20someone does experience a clogged drainpipe effect, is it possible to ""train it away""? That is, to, with 1000 hours of practice, get to a point where their life largely looks the same as it did before except that they report no longer experiencing the effect (and this is borne out by measures of # of quality-adjusted ideas babbled per time unit, or similar)? (It doesn't count if the only way of doing it is by, say, making sure to write 10 ideas every day, or something similar. I'm wondering if it's possible to change your cognition at a deep level, rather than using particular, deliberate, S2 techniques to sustain an equilibirum which you'd fall out of if you stopped using the techniques)&binaryQuestions.sortBy=popularity&limit=20&offset=0","Elicit",true,"63.15%",26,13
"Lab-grown meat on sale at 20 times the price of animal-grown meat or cheaper.","https://elicit.org/binary?binaryQuestions.search=Lab-grown%20meat on sale at 20 times the price of animal-grown meat or cheaper.&binaryQuestions.sortBy=popularity&limit=20&offset=0","Elicit",true,"63.33%",15,12
"The world’s first lunar tourist by end of 2035","https://elicit.org/binary?binaryQuestions.search=The%20world’s first lunar tourist by end of 2035&binaryQuestions.sortBy=popularity&limit=20&offset=0","Elicit",true,"51.07%",14,12
"At the end of the year, all SlateStarCodex archives are rehosted by Scott on SlateStarCodex or some other site (third-party created archives don't count) AND Scott has written at least one new post on SlateStarCodex or this new site","https://elicit.org/binary?binaryQuestions.search=At%20the end of the year, all SlateStarCodex archives are rehosted by Scott on SlateStarCodex or some other site (third-party created archives don't count) AND Scott has written at least one new post on SlateStarCodex or this new site&binaryQuestions.sortBy=popularity&limit=20&offset=0","Elicit",true,"78.92%",13,12
"The world’s first lunar tourist by end of 2025","https://elicit.org/binary?binaryQuestions.search=The%20world’s first lunar tourist by end of 2025&binaryQuestions.sortBy=popularity&limit=20&offset=0","Elicit",true,"30.40%",15,12
"""Mankind is unlikely to exist in anything like its present form in 2150."" -lukeprog","https://elicit.org/binary?binaryQuestions.search=""Mankind%20is unlikely to exist in anything like its present form in 2150."" -lukeprog&binaryQuestions.sortBy=popularity&limit=20&offset=0","Elicit",true,"66.54%",13,12
"Simon Cowell will be cryogenically stored.","https://elicit.org/binary?binaryQuestions.search=Simon%20Cowell will be cryogenically stored.&binaryQuestions.sortBy=popularity&limit=20&offset=0","Elicit",true,"18.25%",12,12
"Russia will be an Islamic theocracy by 31 December 2050.","https://elicit.org/binary?binaryQuestions.search=Russia%20will be an Islamic theocracy by 31 December 2050.&binaryQuestions.sortBy=popularity&limit=20&offset=0","Elicit",true,"1.31%",13,12
"Riemann hypothesis proven by 2040. -- Axel Boldt","https://elicit.org/binary?binaryQuestions.search=Riemann%20hypothesis proven by 2040. -- Axel Boldt&binaryQuestions.sortBy=popularity&limit=20&offset=0","Elicit",true,"37.08%",13,12
"“By 2030, commercial passengers will routinely fly in pilotless planes.”","https://elicit.org/binary?binaryQuestions.search=“By%202030, commercial passengers will routinely fly in pilotless planes.”&binaryQuestions.sortBy=popularity&limit=20&offset=0","Elicit",true,"35.00%",12,12
"Donald Knuth will die before finishing TAOCP.","https://elicit.org/binary?binaryQuestions.search=Donald%20Knuth will die before finishing TAOCP.&binaryQuestions.sortBy=popularity&limit=20&offset=0","Elicit",true,"86.83%",12,12
"Warren Buffett: All cars on the road will be electric by year 2030","https://elicit.org/binary?binaryQuestions.search=Warren%20Buffett: All cars on the road will be electric by year 2030&binaryQuestions.sortBy=popularity&limit=20&offset=0","Elicit",true,"33.58%",12,12
"'By the end of the decade, it will be clear that North Korea never had nuclear weapons under Kim Jong Il.' --Kevin","https://elicit.org/binary?binaryQuestions.search='By%20the end of the decade, it will be clear that North Korea never had nuclear weapons under Kim Jong Il.' --Kevin&binaryQuestions.sortBy=popularity&limit=20&offset=0","Elicit",true,"14.17%",12,12
"The effect of First contact is mostly neutral (e.g., invisible, indifferent, uninteresting, mild nuisance )","https://elicit.org/binary?binaryQuestions.search=The%20effect of First contact is mostly neutral (e.g., invisible, indifferent, uninteresting, mild nuisance )&binaryQuestions.sortBy=popularity&limit=20&offset=0","Elicit",true,"55.00%",26,11
"The effect of First contact is mostly harmful (e.g., selfish ETI, hazards) ","https://elicit.org/binary?binaryQuestions.search=The%20effect of First contact is mostly harmful (e.g., selfish ETI, hazards) &binaryQuestions.sortBy=popularity&limit=20&offset=0","Elicit",true,"40.82%",22,11
"GRRM dies before finishing _A Song of Ice and Fire_","https://elicit.org/binary?binaryQuestions.search=GRRM%20dies before finishing _A Song of Ice and Fire_&binaryQuestions.sortBy=popularity&limit=20&offset=0","Elicit",true,"41.54%",13,11
"""within 5 years of leaving office, the Obamas will have a net worth of more than $50 million."" --Dennis Mangan","https://elicit.org/binary?binaryQuestions.search=""within%205 years of leaving office, the Obamas will have a net worth of more than $50 million."" --Dennis Mangan&binaryQuestions.sortBy=popularity&limit=20&offset=0","Elicit",true,"64.82%",11,11
"Will any of the NYT Coronavirus vaccine tracker numbers increase between 9am PST Fri 11/20 and 9am PST Sun 11/22?","https://elicit.org/binary?binaryQuestions.search=Will%20any of the NYT Coronavirus vaccine tracker numbers increase between 9am PST Fri 11/20 and 9am PST Sun 11/22?&binaryQuestions.sortBy=popularity&limit=20&offset=0","Elicit",true,"76.33%",15,11
"Arbital to become a top-1000 site by 2020","https://elicit.org/binary?binaryQuestions.search=Arbital%20to become a top-1000 site by 2020&binaryQuestions.sortBy=popularity&limit=20&offset=0","Elicit",true,"9.00%",12,11
"Heterogenity of ETI: Are they all the ""same""? Over millions of years of evolution beyond humanity, have they evolved and converged to some ""final being""?","https://elicit.org/binary?binaryQuestions.search=Heterogenity%20of ETI: Are they all the ""same""? Over millions of years of evolution beyond humanity, have they evolved and converged to some ""final being""?&binaryQuestions.sortBy=popularity&limit=20&offset=0","Elicit",true,"26.27%",11,11
"The effect of First contact is mostly beneficial (e.g., cooperative or merely detectable)","https://elicit.org/binary?binaryQuestions.search=The%20effect of First contact is mostly beneficial (e.g., cooperative or merely detectable)&binaryQuestions.sortBy=popularity&limit=20&offset=0","Elicit",true,"28.88%",25,11
"Will humans (at least one) leave the solar system within 10 years after First Contact?","https://elicit.org/binary?binaryQuestions.search=Will%20humans (at least one) leave the solar system within 10 years after First Contact?&binaryQuestions.sortBy=popularity&limit=20&offset=0","Elicit",true,"33.20%",15,11
"Will any LessWrong post made on Friday 11/20 get more than 100 karma by 9am PST on Sun 11/22?","https://elicit.org/binary?binaryQuestions.search=Will%20any LessWrong post made on Friday 11/20 get more than 100 karma by 9am PST on Sun 11/22?&binaryQuestions.sortBy=popularity&limit=20&offset=0","Elicit",true,"17.54%",13,11
"""In the next 10 years, I expect at least five billion people worldwide to own smartphones"" --Marc Andreessen","https://elicit.org/binary?binaryQuestions.search=""In%20the next 10 years, I expect at least five billion people worldwide to own smartphones"" --Marc Andreessen&binaryQuestions.sortBy=popularity&limit=20&offset=0","Elicit",true,"75.17%",12,11
