"Title","URL","Platform","Binary question?","Percentage","# Forecasts","# Forecasters"
"Will First Contact happen in the form of a message (e.g. radio waves), rather than by physical visitors?","https://elicit.org/binary?binaryQuestions.search=Will%20First Contact happen in the form of a message (e.g. radio waves), rather than by physical visitors?&binaryQuestions.sortBy=popularity&limit=20&offset=0","Elicit",true,"64.80%",40,18
"Cultural Intelligence Hypothesis: humans evolved big brains in order to be able to maintain [complicated, detailed, arbitrary-seeming cultural knowledge like 20+ step Inuit seal hunting techniques]. Everything that separates us from the apes is part of an evolutionary package designed to help us maintain this kind of culture, exploit this kind of culture, or adjust to the new abilities that this kind of culture gave us. ","https://elicit.org/binary?binaryQuestions.search=Cultural%20Intelligence Hypothesis: humans evolved big brains in order to be able to maintain [complicated, detailed, arbitrary-seeming cultural knowledge like 20+ step Inuit seal hunting techniques]. Everything that separates us from the apes is part of an evolutionary package designed to help us maintain this kind of culture, exploit this kind of culture, or adjust to the new abilities that this kind of culture gave us. &binaryQuestions.sortBy=popularity&limit=20&offset=0","Elicit",true,"34.33%",45,18
"Does Pareto frontier trick allow people to circumvent the Generalized Efficient Market hypothesis? That is, take people in the 98th percentile of intelligence. Are there a few separate fields such that they could become experts in each, with less than 10 years of total time investment... and then have a realistic shot at a big money/status windfall, with relatively little *marginal* effort.","https://elicit.org/binary?binaryQuestions.search=Does%20Pareto frontier trick allow people to circumvent the Generalized Efficient Market hypothesis? That is, take people in the 98th percentile of intelligence. Are there a few separate fields such that they could become experts in each, with less than 10 years of total time investment... and then have a realistic shot at a big money/status windfall, with relatively little *marginal* effort.&binaryQuestions.sortBy=popularity&limit=20&offset=0","Elicit",true,"69.74%",19,18
"The modern Scientific Revolution occurred in Europe between the 16th and 18th Centuries. Why did it not happen in China? Historian Toby Huff claims the reason is that China was unable to produce modern science primarily because a lack of the requisite intellectual freedom. Was he basically correct?","https://elicit.org/binary?binaryQuestions.search=The%20modern Scientific Revolution occurred in Europe between the 16th and 18th Centuries. Why did it not happen in China? Historian Toby Huff claims the reason is that China was unable to produce modern science primarily because a lack of the requisite intellectual freedom. Was he basically correct?&binaryQuestions.sortBy=popularity&limit=20&offset=0","Elicit",true,"36.67%",21,18
"What percentage of people experience a ""Clogged drainpipe"" effect in idea generation? (That is, they'd agree that they recognised the feeling as described in the post, after attempting a babble challenge)","https://elicit.org/binary?binaryQuestions.search=What%20percentage of people experience a ""Clogged drainpipe"" effect in idea generation? (That is, they'd agree that they recognised the feeling as described in the post, after attempting a babble challenge)&binaryQuestions.sortBy=popularity&limit=20&offset=0","Elicit",true,"64.34%",50,18
"We will make First Contact before we will have AGI.","https://elicit.org/binary?binaryQuestions.search=We%20will make First Contact before we will have AGI.&binaryQuestions.sortBy=popularity&limit=20&offset=0","Elicit",true,"12.05%",21,18
"“No human will set his or her foot on Mars and return safely to earth before 2050.”","https://elicit.org/binary?binaryQuestions.search=“No%20human will set his or her foot on Mars and return safely to earth before 2050.”&binaryQuestions.sortBy=popularity&limit=20&offset=0","Elicit",true,"40.27%",26,18
"Trump eventually signs an executive order forcing everyone to kneel in his presence","https://elicit.org/binary?binaryQuestions.search=Trump%20eventually signs an executive order forcing everyone to kneel in his presence&binaryQuestions.sortBy=popularity&limit=20&offset=0","Elicit",true,"3.32%",22,18
"The percentage of people professing to be both athiest and agnostic will increase over the next decade","https://elicit.org/binary?binaryQuestions.search=The%20percentage of people professing to be both athiest and agnostic will increase over the next decade&binaryQuestions.sortBy=popularity&limit=20&offset=0","Elicit",true,"67.55%",22,18
"Between 2016-2116, at least 1 American President will be neither Democratic or Republican.","https://elicit.org/binary?binaryQuestions.search=Between%202016-2116, at least 1 American President will be neither Democratic or Republican.&binaryQuestions.sortBy=popularity&limit=20&offset=0","Elicit",true,"51.78%",18,18
"There will be driverless taxis available for use by the public in at least one US city in 2023.","https://elicit.org/binary?binaryQuestions.search=There%20will be driverless taxis available for use by the public in at least one US city in 2023.&binaryQuestions.sortBy=popularity&limit=20&offset=0","Elicit",true,"64.28%",18,18
"A Level 7 (Chernobyl/2011 Japan level) nuclear accident will take place by end of 2020.","https://elicit.org/binary?binaryQuestions.search=A%20Level 7 (Chernobyl/2011 Japan level) nuclear accident will take place by end of 2020.&binaryQuestions.sortBy=popularity&limit=20&offset=0","Elicit",true,"21.62%",21,17
"Another version: roughly, everything that top-humans can learn, most humans can too if they actually tried. That is, there is psychological unity of humankind in what we can learn, but not necessarily what we have learned. By contrast, a mouse really couldn't learn chess, even if they tried. And in turn, no human can learn to play 90-dimensional chess, unlike the hypothetical superintelligences that can.","https://elicit.org/binary?binaryQuestions.search=Another%20version: roughly, everything that top-humans can learn, most humans can too if they actually tried. That is, there is psychological unity of humankind in what we can learn, but not necessarily what we have learned. By contrast, a mouse really couldn't learn chess, even if they tried. And in turn, no human can learn to play 90-dimensional chess, unlike the hypothetical superintelligences that can.&binaryQuestions.sortBy=popularity&limit=20&offset=0","Elicit",true,"29.78%",32,17
"It will be illegal to drive yourself on USA public roads ","https://elicit.org/binary?binaryQuestions.search=It%20will be illegal to drive yourself on USA public roads &binaryQuestions.sortBy=popularity&limit=20&offset=0","Elicit",true,"1.72%",18,17
"My net financial worth will be greater than 10 million (2012-inflation adjusted), or enough to indefinitely earn a passive income to provide 100 people with cryonics, (whichever of the two is greater), by 2028","https://elicit.org/binary?binaryQuestions.search=My%20net financial worth will be greater than 10 million (2012-inflation adjusted), or enough to indefinitely earn a passive income to provide 100 people with cryonics, (whichever of the two is greater), by 2028&binaryQuestions.sortBy=popularity&limit=20&offset=0","Elicit",true,"8.39%",18,17
"The Millennium Prize for solving P Versus NP will remain unclaimed by 2020.","https://elicit.org/binary?binaryQuestions.search=The%20Millennium Prize for solving P Versus NP will remain unclaimed by 2020.&binaryQuestions.sortBy=popularity&limit=20&offset=0","Elicit",true,"83.95%",21,17
"Nuclear power plants will no longer operate by the year 2020.","https://elicit.org/binary?binaryQuestions.search=Nuclear%20power plants will no longer operate by the year 2020.&binaryQuestions.sortBy=popularity&limit=20&offset=0","Elicit",true,"12.79%",19,17
"aliens invade earth in 2023","https://elicit.org/binary?binaryQuestions.search=aliens%20invade earth in 2023&binaryQuestions.sortBy=popularity&limit=20&offset=0","Elicit",true,"0.94%",18,17
"Robin Hanson's brain will be cryogenically frozen.","https://elicit.org/binary?binaryQuestions.search=Robin%20Hanson's brain will be cryogenically frozen.&binaryQuestions.sortBy=popularity&limit=20&offset=0","Elicit",true,"47.17%",23,17
"...be an environmental disaster.","https://elicit.org/binary?binaryQuestions.search=...be%20an environmental disaster.&binaryQuestions.sortBy=popularity&limit=20&offset=0","Elicit",true,"30.95%",19,17
"Russia will not have established moon bases by 2032","https://elicit.org/binary?binaryQuestions.search=Russia%20will not have established moon bases by 2032&binaryQuestions.sortBy=popularity&limit=20&offset=0","Elicit",true,"69.33%",18,17
"'2021 The first humans land on Mars.' --Arthur C. Clarke","https://elicit.org/binary?binaryQuestions.search='2021%20The first humans land on Mars.' --Arthur C. Clarke&binaryQuestions.sortBy=popularity&limit=20&offset=0","Elicit",true,"1.80%",25,17
"Human-level artificial general intelligence by 2030","https://elicit.org/binary?binaryQuestions.search=Human-level%20artificial general intelligence by 2030&binaryQuestions.sortBy=popularity&limit=20&offset=0","Elicit",true,"26.89%",19,17
"A professional athlete will voluntarily amputate their legs to use prosthetics like Oscar Pistorius, by 2021","https://elicit.org/binary?binaryQuestions.search=A%20professional athlete will voluntarily amputate their legs to use prosthetics like Oscar Pistorius, by 2021&binaryQuestions.sortBy=popularity&limit=20&offset=0","Elicit",true,"30.95%",20,17
"“One or more space agencies will send a manned mission to Mars by 2035.”","https://elicit.org/binary?binaryQuestions.search=“One%20or more space agencies will send a manned mission to Mars by 2035.”&binaryQuestions.sortBy=popularity&limit=20&offset=0","Elicit",true,"35.00%",23,17
"An open atheist will be elected US President within 20 years.","https://elicit.org/binary?binaryQuestions.search=An%20open atheist will be elected US President within 20 years.&binaryQuestions.sortBy=popularity&limit=20&offset=0","Elicit",true,"8.12%",17,16
"Information recorded in the predictionbook will be practically retrievable ""in ten thousand years, or so""","https://elicit.org/binary?binaryQuestions.search=Information%20recorded in the predictionbook will be practically retrievable ""in ten thousand years, or so""&binaryQuestions.sortBy=popularity&limit=20&offset=0","Elicit",true,"19.11%",19,16
"If we receive a message from outer space, will it be in a form already accessible today (e.g., radio waves)?","https://elicit.org/binary?binaryQuestions.search=If%20we receive a message from outer space, will it be in a form already accessible today (e.g., radio waves)?&binaryQuestions.sortBy=popularity&limit=20&offset=0","Elicit",true,"77.71%",17,16
"By 2026 we will be technically capable of fixing arbitrary single-gene disorders - sickle cell anaemia, Huntington's, cystic fibrosis, Tay-Sachs, muscular dystrophy... - in living humans, with close to zero risk of severe complications.","https://elicit.org/binary?binaryQuestions.search=By%202026 we will be technically capable of fixing arbitrary single-gene disorders - sickle cell anaemia, Huntington's, cystic fibrosis, Tay-Sachs, muscular dystrophy... - in living humans, with close to zero risk of severe complications.&binaryQuestions.sortBy=popularity&limit=20&offset=0","Elicit",true,"34.67%",18,16
"US presidents term limits abolished","https://elicit.org/binary?binaryQuestions.search=US%20presidents term limits abolished&binaryQuestions.sortBy=popularity&limit=20&offset=0","Elicit",true,"2.24%",17,16
"The strategy-stealing assumption is ""a good enough approximation that we can basically act as if it’s true"". That is, for any strategy an unaligned AI could use to influence the long-run future, there is an analogous strategy that a similarly-sized group of humans can use in order to capture a similar amount of flexible influence over the future. By “flexible” is meant that humans can decide later what to do with that influence  (which is important since humans don’t yet know what we want in the long run).","https://elicit.org/binary?binaryQuestions.search=The%20strategy-stealing assumption is ""a good enough approximation that we can basically act as if it’s true"". That is, for any strategy an unaligned AI could use to influence the long-run future, there is an analogous strategy that a similarly-sized group of humans can use in order to capture a similar amount of flexible influence over the future. By “flexible” is meant that humans can decide later what to do with that influence  (which is important since humans don’t yet know what we want in the long run).&binaryQuestions.sortBy=popularity&limit=20&offset=0","Elicit",true,"29.04%",24,16
"Will the UK terrorism threat level be ‘severe’ at 9am PST on Sun 11/22?","https://elicit.org/binary?binaryQuestions.search=Will%20the UK terrorism threat level be ‘severe’ at 9am PST on Sun 11/22?&binaryQuestions.sortBy=popularity&limit=20&offset=0","Elicit",true,"81.00%",24,16
"Man will travel to Mars by 2030. ","https://elicit.org/binary?binaryQuestions.search=Man%20will travel to Mars by 2030. &binaryQuestions.sortBy=popularity&limit=20&offset=0","Elicit",true,"42.89%",18,16
"Legal challenges initiated by the Donald Trump campaign will not change the outcome of the US Presidential election","https://elicit.org/binary?binaryQuestions.search=Legal%20challenges initiated by the Donald Trump campaign will not change the outcome of the US Presidential election&binaryQuestions.sortBy=popularity&limit=20&offset=0","Elicit",true,"95.32%",19,16
"Some people living today (October 17th, 2009) will also be alive on October 17th, 3009.","https://elicit.org/binary?binaryQuestions.search=Some%20people living today (October 17th, 2009) will also be alive on October 17th, 3009.&binaryQuestions.sortBy=popularity&limit=20&offset=0","Elicit",true,"35.53%",19,16
"Elon Musk will come out as trans (MtF or MtX)","https://elicit.org/binary?binaryQuestions.search=Elon%20Musk will come out as trans (MtF or MtX)&binaryQuestions.sortBy=popularity&limit=20&offset=0","Elicit",true,"4.13%",16,16
"A Mars colony will be established in 2026. It will be an International establishment.","https://elicit.org/binary?binaryQuestions.search=A%20Mars colony will be established in 2026. It will be an International establishment.&binaryQuestions.sortBy=popularity&limit=20&offset=0","Elicit",true,"4.90%",20,16
"An alive human has been on mars soil and returned to earth safely before year 2100.","https://elicit.org/binary?binaryQuestions.search=An%20alive human has been on mars soil and returned to earth safely before year 2100.&binaryQuestions.sortBy=popularity&limit=20&offset=0","Elicit",true,"57.78%",18,16
"Kamala Harris will be president on Nov. 1, 2021.","https://elicit.org/binary?binaryQuestions.search=Kamala%20Harris will be president on Nov. 1, 2021.&binaryQuestions.sortBy=popularity&limit=20&offset=0","Elicit",true,"11.81%",16,15
"If a message from outer space is detected, will we answer it?","https://elicit.org/binary?binaryQuestions.search=If%20a message from outer space is detected, will we answer it?&binaryQuestions.sortBy=popularity&limit=20&offset=0","Elicit",true,"73.94%",17,15
"If we answer it, will it be a single answer sent by all of humanity?","https://elicit.org/binary?binaryQuestions.search=If%20we answer it, will it be a single answer sent by all of humanity?&binaryQuestions.sortBy=popularity&limit=20&offset=0","Elicit",true,"29.44%",16,15
"If First Contact yields information beyond current human knowledge, will it be shared and made available for all humans?","https://elicit.org/binary?binaryQuestions.search=If%20First Contact yields information beyond current human knowledge, will it be shared and made available for all humans?&binaryQuestions.sortBy=popularity&limit=20&offset=0","Elicit",true,"66.47%",17,15
"Will the title of the New York Times front page article on Sun 11/22 include any of the words: ‘coronavirus,’ ‘COVID-19,’ ‘COVID,’ or ‘SARS-CoV-2’?","https://elicit.org/binary?binaryQuestions.search=Will%20the title of the New York Times front page article on Sun 11/22 include any of the words: ‘coronavirus,’ ‘COVID-19,’ ‘COVID,’ or ‘SARS-CoV-2’?&binaryQuestions.sortBy=popularity&limit=20&offset=0","Elicit",true,"25.33%",24,15
"Extraterrestrial  life will be confirmed on at least one body by 2050. ","https://elicit.org/binary?binaryQuestions.search=Extraterrestrial%20 life will be confirmed on at least one body by 2050. &binaryQuestions.sortBy=popularity&limit=20&offset=0","Elicit",true,"55.18%",17,15
"Overall, in 2019, biosecurity in the context of catastrophic risks had been underfunded and underdiscussed.","https://elicit.org/binary?binaryQuestions.search=Overall,%20in 2019, biosecurity in the context of catastrophic risks had been underfunded and underdiscussed.&binaryQuestions.sortBy=popularity&limit=20&offset=0","Elicit",true,"80.50%",18,15
"Ghislane Maxwell will die by the end of the year 12/31","https://elicit.org/binary?binaryQuestions.search=Ghislane%20Maxwell will die by the end of the year 12/31&binaryQuestions.sortBy=popularity&limit=20&offset=0","Elicit",true,"14.48%",25,15
"...substantially improve current housing shortages and rent prices by 2035. ","https://elicit.org/binary?binaryQuestions.search=...substantially%20improve current housing shortages and rent prices by 2035. &binaryQuestions.sortBy=popularity&limit=20&offset=0","Elicit",true,"64.47%",15,15
"The Great Filter is the discovery of AGI, because it destroys their creators (us humans).","https://elicit.org/binary?binaryQuestions.search=The%20Great Filter is the discovery of AGI, because it destroys their creators (us humans).&binaryQuestions.sortBy=popularity&limit=20&offset=0","Elicit",true,"28.00%",20,15
"A CRISPR-edited human baby will be born by 2020","https://elicit.org/binary?binaryQuestions.search=A%20CRISPR-edited human baby will be born by 2020&binaryQuestions.sortBy=popularity&limit=20&offset=0","Elicit",true,"43.47%",19,15
"Are there simple changes to chimps (or other animals) that would make them much better at accumulating culture?","https://elicit.org/binary?binaryQuestions.search=Are%20there simple changes to chimps (or other animals) that would make them much better at accumulating culture?&binaryQuestions.sortBy=popularity&limit=20&offset=0","Elicit",true,"56.90%",29,15
"Will humans continually pursue all simple yet powerful changes to our AIs?","https://elicit.org/binary?binaryQuestions.search=Will%20humans continually pursue all simple yet powerful changes to our AIs?&binaryQuestions.sortBy=popularity&limit=20&offset=0","Elicit",true,"59.36%",25,15
"Mark Zuckerberg, co-founder of Facebook, is President of the United States before 2026","https://elicit.org/binary?binaryQuestions.search=Mark%20Zuckerberg, co-founder of Facebook, is President of the United States before 2026&binaryQuestions.sortBy=popularity&limit=20&offset=0","Elicit",true,"3.71%",17,15
"There will NOT be a ""World War III"" within the next 10 years. (Between Russia and it's ""allies"" and NATO and/or western europe)","https://elicit.org/binary?binaryQuestions.search=There%20will NOT be a ""World War III"" within the next 10 years. (Between Russia and it's ""allies"" and NATO and/or western europe)&binaryQuestions.sortBy=popularity&limit=20&offset=0","Elicit",true,"93.31%",16,15
"C still widely in use in the 2020s","https://elicit.org/binary?binaryQuestions.search=C%20still widely in use in the 2020s&binaryQuestions.sortBy=popularity&limit=20&offset=0","Elicit",true,"93.53%",15,15
"USA will collapse before the People's Republic of China.","https://elicit.org/binary?binaryQuestions.search=USA%20will collapse before the People's Republic of China.&binaryQuestions.sortBy=popularity&limit=20&offset=0","Elicit",true,"41.47%",17,15
"Jesus will not come down from the heavens to judge mankind in my life time, my childrens life time, or my grand-childrens life time.","https://elicit.org/binary?binaryQuestions.search=Jesus%20will not come down from the heavens to judge mankind in my life time, my childrens life time, or my grand-childrens life time.&binaryQuestions.sortBy=popularity&limit=20&offset=0","Elicit",true,"92.69%",16,15
"""by 2030 we should have the capability to upload a person’s consciousness to a computer system""","https://elicit.org/binary?binaryQuestions.search=""by%202030 we should have the capability to upload a person’s consciousness to a computer system""&binaryQuestions.sortBy=popularity&limit=20&offset=0","Elicit",true,"6.20%",15,14
"Will we understand the content of a message from outer space?","https://elicit.org/binary?binaryQuestions.search=Will%20we understand the content of a message from outer space?&binaryQuestions.sortBy=popularity&limit=20&offset=0","Elicit",true,"47.39%",18,14
"The United States will reach less than 3% unemployment at some point within the next 15 years.","https://elicit.org/binary?binaryQuestions.search=The%20United States will reach less than 3% unemployment at some point within the next 15 years.&binaryQuestions.sortBy=popularity&limit=20&offset=0","Elicit",true,"11.73%",15,14
"Gay marriage will remain legal throughout a Trump presidency.","https://elicit.org/binary?binaryQuestions.search=Gay%20marriage will remain legal throughout a Trump presidency.&binaryQuestions.sortBy=popularity&limit=20&offset=0","Elicit",true,"87.18%",17,14
"Banning of incandescent light bulbs globally by 2022.Incandescent lightbulbs will not be bought, manufactured or sold legally.
","https://elicit.org/binary?binaryQuestions.search=Banning%20of incandescent light bulbs globally by 2022.Incandescent lightbulbs will not be bought, manufactured or sold legally.
&binaryQuestions.sortBy=popularity&limit=20&offset=0","Elicit",true,"11.19%",16,14
"If First Contact is in physical form, will the ETI be in biological form?","https://elicit.org/binary?binaryQuestions.search=If%20First Contact is in physical form, will the ETI be in biological form?&binaryQuestions.sortBy=popularity&limit=20&offset=0","Elicit",true,"17.39%",18,14
"The message begins with ""Execute this algorithm on a computer today, or I will make your sun go supernova tomorrow"". Should we execute it?","https://elicit.org/binary?binaryQuestions.search=The%20message begins with ""Execute this algorithm on a computer today, or I will make your sun go supernova tomorrow"". Should we execute it?&binaryQuestions.sortBy=popularity&limit=20&offset=0","Elicit",true,"7.86%",14,14
"...cause a water shortage such that, in 2030, residents of the Bay Area would spend on average 100% more on water, after adjusting for inflation, compared to 2020. (In 2020 the average American spends around $200/year on water)","https://elicit.org/binary?binaryQuestions.search=...cause%20a water shortage such that, in 2030, residents of the Bay Area would spend on average 100% more on water, after adjusting for inflation, compared to 2020. (In 2020 the average American spends around $200/year on water)&binaryQuestions.sortBy=popularity&limit=20&offset=0","Elicit",true,"18.07%",15,14
"Microsoft will release the source code to the current version of Windows under a free-software license.","https://elicit.org/binary?binaryQuestions.search=Microsoft%20will release the source code to the current version of Windows under a free-software license.&binaryQuestions.sortBy=popularity&limit=20&offset=0","Elicit",true,"14.00%",15,14
"In the next ten years, scientists will publish a paper in a refereed journal claiming to have experimentally moved matter faster than the speed of light. ","https://elicit.org/binary?binaryQuestions.search=In%20the next ten years, scientists will publish a paper in a refereed journal claiming to have experimentally moved matter faster than the speed of light. &binaryQuestions.sortBy=popularity&limit=20&offset=0","Elicit",true,"9.47%",15,14
"The next non-Democrat to win the White House will also be a non-Republican.","https://elicit.org/binary?binaryQuestions.search=The%20next non-Democrat to win the White House will also be a non-Republican.&binaryQuestions.sortBy=popularity&limit=20&offset=0","Elicit",true,"17.00%",15,14
"""Within ten years the SAT testing service will require students to take a blood test to prove they are not on cognitive enhancing drugs."" --James Miller","https://elicit.org/binary?binaryQuestions.search=""Within%20ten years the SAT testing service will require students to take a blood test to prove they are not on cognitive enhancing drugs."" --James Miller&binaryQuestions.sortBy=popularity&limit=20&offset=0","Elicit",true,"9.55%",20,14
"I will not pass Eliezer in LW karma in the next 10 years.","https://elicit.org/binary?binaryQuestions.search=I%20will not pass Eliezer in LW karma in the next 10 years.&binaryQuestions.sortBy=popularity&limit=20&offset=0","Elicit",true,"82.20%",15,14
"The United States will contain less than 50 states by 2025.","https://elicit.org/binary?binaryQuestions.search=The%20United States will contain less than 50 states by 2025.&binaryQuestions.sortBy=popularity&limit=20&offset=0","Elicit",true,"9.82%",17,14
"North Korea invades South Korea before the end of 2020","https://elicit.org/binary?binaryQuestions.search=North%20Korea invades South Korea before the end of 2020&binaryQuestions.sortBy=popularity&limit=20&offset=0","Elicit",true,"5.94%",17,14
