"Title","URL","Platform","Binary question?","Percentage","# Forecasts","# Forecasters"
"Will there be a complex coordinated terrorist attack (CCTA) in the United States either directed or inspired by a foreign terrorist organization before 1 September 2021?","https://www.gjopen.com/questions/1780-will-there-be-a-complex-coordinated-terrorist-attack-ccta-in-the-united-states-either-directed-or-inspired-by-a-foreign-terrorist-organization-before-1-september-2021","Good Judgment Open",true,"5%","299","149"
"Will any 2020 California election results be altered by a cyberattack against a voting system?","https://www.gjopen.com/questions/1782-will-any-2020-california-election-results-be-altered-by-a-cyberattack-against-a-voting-system","Good Judgment Open",true,"0%","260","135"
"Will there be a complex coordinated terrorist attack (CCTA) in the United States before 1 September 2021?","https://www.gjopen.com/questions/1781-will-there-be-a-complex-coordinated-terrorist-attack-ccta-in-the-united-states-before-1-september-2021","Good Judgment Open",true,"25%","437","133"
"When will the Transportation Security Administration (TSA) next screen two million or more travelers in a single day?","https://www.gjopen.com/questions/1776-when-will-the-transportation-security-administration-tsa-next-screen-two-million-or-more-travelers-in-a-single-day","Good Judgment Open",false,"none","604","152"
"In Google v. Oracle America, will the Supreme Court rule that the Copyright Act protects the Oracle computer source code that Google copied for its Android operating system?","https://www.gjopen.com/questions/1775-in-google-v-oracle-america-will-the-supreme-court-rule-that-the-copyright-act-protects-the-oracle-computer-source-code-that-google-copied-for-its-android-operating-system","Good Judgment Open",true,"90%","180","71"
"In California v. Texas, will the Supreme Court rule that reducing the penalty amount for the individual mandate of the Affordable Care Act (ACA) to zero rendered the individual mandate provision unconstitutional?","https://www.gjopen.com/questions/1774-in-california-v-texas-will-the-supreme-court-rule-that-reducing-the-penalty-amount-for-the-individual-mandate-of-the-affordable-care-act-aca-to-zero-rendered-the-individual-mandate-provision-unconstitutional","Good Judgment Open",true,"","288","72"
"Before 1 January 2022, will the United States Olympic Committee announce that it is boycotting the 2022 Winter Olympics?","https://www.gjopen.com/questions/1764-before-1-january-2022-will-the-united-states-olympic-committee-announce-that-it-is-boycotting-the-2022-winter-olympics","Good Judgment Open",true,"4%","438","162"
"How many Arab League member states other than Palestine will diplomatically recognize the State of Israel as of 28 August 2021?","https://www.gjopen.com/questions/1763-how-many-arab-league-member-states-other-than-palestine-will-diplomatically-recognize-the-state-of-israel-as-of-28-august-2021","Good Judgment Open",false,"none","428","88"
"When will the EU amend its Own Resources Decision to help finance the EU's proposed COVID-19 recovery package?","https://www.gjopen.com/questions/1762-when-will-the-eu-amend-its-own-resources-decision-to-help-finance-the-eu-s-proposed-covid-19-recovery-package","Good Judgment Open",false,"none","176","47"
"How many Cybertrucks will Tesla deliver to customers in 2022?","https://www.gjopen.com/questions/1760-how-many-cybertrucks-will-tesla-deliver-to-customers-in-2022","Good Judgment Open",false,"none","247","75"
"Before 1 January 2023, will Amazon or a subsidiary use a Zoox autonomous vehicle to deliver a package and/or for a public ride-hailing service?","https://www.gjopen.com/questions/1745-before-1-january-2023-will-amazon-or-a-subsidiary-use-a-zoox-autonomous-vehicle-to-deliver-a-package-and-or-for-a-public-ride-hailing-service","Good Judgment Open",false,"none","182","70"
"Before 14 February 2021, will former King Juan Carlos I and/or former Catalan President Carles Puigdemont return to Spain?","https://www.gjopen.com/questions/1740-before-14-february-2021-will-former-king-juan-carlos-i-and-or-former-catalan-president-carles-puigdemont-return-to-spain","Good Judgment Open",false,"none","214","96"
"Before 1 January 2023, how many major automakers will debut a passenger vehicle powered by a solid-state battery?","https://www.gjopen.com/questions/1744-before-1-january-2023-how-many-major-automakers-will-debut-a-passenger-vehicle-powered-by-a-solid-state-battery","Good Judgment Open",false,"none","189","52"
"When will SpaceX's satellite internet service, Starlink, begin offering commercial service in North America?","https://www.gjopen.com/questions/1741-when-will-spacex-s-satellite-internet-service-starlink-begin-offering-commercial-service-in-north-america","Good Judgment Open",false,"none","432","92"
"Between August 2020 and July 2021, will global land and ocean surface temperatures rise 1.5°C or more above the 20th century average for any single month?","https://www.gjopen.com/questions/1715-between-august-2020-and-july-2021-will-global-land-and-ocean-surface-temperatures-rise-1-5-c-or-more-above-the-20th-century-average-for-any-single-month","Good Judgment Open",true,"2%","247","123"
"Before 1 January 2022, will the U.S. Senate expand the scope of matters for which a filibuster cannot be used?","https://www.gjopen.com/questions/1718-before-1-january-2022-will-the-u-s-senate-expand-the-scope-of-matters-for-which-a-filibuster-cannot-be-used","Good Judgment Open",true,"3%","473","127"
"When will a Carnival Cruise Line cruise next depart from the continental U.S.?","https://www.gjopen.com/questions/1711-when-will-a-carnival-cruise-lines-cruise-next-depart-from-the-continental-u-s","Good Judgment Open",false,"none","818","253"
"Between 1 January 2021 and 31 December 2022, will a firm or paid backup driver operating a self-driving vehicle face criminal charges in relation to an accident involving a self-driving vehicle in the U.S.?","https://www.gjopen.com/questions/1696-between-1-january-2021-and-31-december-2022-will-a-firm-or-paid-backup-driver-operating-a-self-driving-vehicle-face-criminal-charges-in-relation-to-an-accident-involving-a-self-driving-vehicle-in-the-u-s","Good Judgment Open",false,"none","177","71"
"How many new energy vehicles (NEVs) will be sold in China in 2021 and 2022 combined?","https://www.gjopen.com/questions/1698-how-many-new-energy-vehicles-nevs-will-be-sold-in-china-in-2021-and-2022-combined","Good Judgment Open",false,"none","166","44"
"How many public DC fast charge electric vehicle charging stations will be available in the United States by 31 December 2022?","https://www.gjopen.com/questions/1678-how-many-public-dc-fast-charge-electric-vehicle-charging-stations-will-be-available-in-the-united-states-by-31-december-2022","Good Judgment Open",false,"none","159","29"
"How many cases of COVID-19 will be reported by the Africa CDC as of 1 April 2021?","https://www.gjopen.com/questions/1674-how-many-cases-of-covid-19-will-be-reported-by-the-africa-cdc-as-of-1-april-2021","Good Judgment Open",false,"none","816","134"
"Before 1 May 2021, will it be officially announced that the Tokyo 2020 Summer Olympics and/or Paralympics will be canceled?","https://www.gjopen.com/questions/1668-before-1-may-2021-will-it-be-officially-announced-that-the-tokyo-2020-summer-olympics-and-or-paralympics-will-be-canceled","Good Judgment Open",false,"none","939","343"
"Between 1 January 2021 and 31 December 2022, will legislation enabling the creation of federal safety standards for autonomous vehicles (AVs) become law?","https://www.gjopen.com/questions/1659-between-1-january-2021-and-31-december-2022-will-legislation-enabling-the-creation-of-federal-safety-standards-for-autonomous-vehicles-avs-become-law","Good Judgment Open",true,"70%","197","94"
"Will there be a lethal confrontation between the national military forces, militia, and/or law enforcement personnel of the People's Republic of China and those of Brunei, Indonesia, Malaysia, the Philippines, Singapore, and/or Vietnam before 1 April 2021?","https://www.gjopen.com/questions/1652-will-there-be-a-lethal-confrontation-between-the-national-military-forces-militia-and-or-law-enforcement-personnel-of-the-people-s-republic-of-china-and-those-of-brunei-indonesia-malaysia-the-philippines-singapore-and-or-vietnam-before-1-april-2021","Good Judgment Open",true,"5%","804","371"
"How many total Model 3 and Model Y vehicles will Tesla deliver to customers in 2021 and 2022?","https://www.gjopen.com/questions/1647-how-many-total-model-3-and-model-y-vehicles-will-tesla-deliver-to-customers-in-2021-and-2022","Good Judgment Open",false,"none","219","67"
"How many total Fast Charge (&gt;22kW) public charging points for electric vehicles will be installed in the European Union by 31 December 2022?","https://www.gjopen.com/questions/1634-how-many-total-fast-charge-22kw-public-charging-points-for-electric-vehicles-will-be-installed-in-the-european-union-by-31-december-2022","Good Judgment Open",false,"none","216","64"
"Before 1 January 2023, how many major automakers will sell a self-driving passenger vehicle manufactured without a steering wheel?","https://www.gjopen.com/questions/1633-before-1-january-2023-how-many-major-automakers-will-sell-a-self-driving-passenger-vehicle-manufactured-without-a-steering-wheel","Good Judgment Open",false,"none","329","181"
"Between 1 January 2021 and 31 December 2022, will the European Union delay and/or relax the implementation and/or enforcement of any of its CO2 emission performance standards for new passenger cars and/or new light commercial vehicles?","https://www.gjopen.com/questions/1620-between-1-january-2021-and-31-december-2022-will-the-european-union-delay-and-or-relax-the-implementation-and-or-enforcement-of-any-of-its-co2-emission-performance-standards-for-new-passenger-cars-and-or-new-light-commercial-vehicles","Good Judgment Open",true,"","161","79"
"What will be the 2022 industry-wide average cost of Li-ion batteries used in battery-powered electric vehicles?","https://www.gjopen.com/questions/1583-what-will-be-the-2022-industry-wide-average-cost-of-li-ion-batteries-used-in-battery-powered-electric-vehicles","Good Judgment Open",false,"none","217","85"
"What total percentage of global vehicle sales in 2022 will be battery electric vehicles (BEVs) and plug-in hybrid electric vehicles (PHEVs)? ","https://www.gjopen.com/questions/1582-what-total-percentage-of-global-vehicle-sales-in-2022-will-be-battery-electric-vehicles-bevs-and-plug-in-hybrid-electric-vehicles-phevs","Good Judgment Open",false,"none","319","130"
"Will there be a new prime minister of Italy before 24 January 2021?","https://www.gjopen.com/questions/1502-will-there-be-a-new-prime-minister-of-italy-before-24-january-2021","Good Judgment Open",true,"1%","825","263"
"Before 1 July 2021, will the Chilean government pass legislation that caps administrative fees and/or operating profits of the country's pension fund managers?","https://www.gjopen.com/questions/1411-before-1-july-2021-will-the-chilean-government-pass-legislation-that-caps-administrative-fees-and-or-operating-profits-of-the-country-s-pension-fund-managers","Good Judgment Open",true,"2%","247","95"
"Before 1 July 2021, will the Chilean government pass legislation nationalizing private pension fund assets?","https://www.gjopen.com/questions/1412-before-1-july-2021-will-the-chilean-government-pass-legislation-nationalizing-private-pension-fund-assets","Good Judgment Open",true,"1%","273","123"
"When will Donald Trump cease to be president of the United States?","https://www.gjopen.com/questions/1290-when-will-donald-trump-cease-to-be-president-of-the-united-states","Good Judgment Open",false,"none","6445","2159"